url,tweet_id,tweet,name,username,fromDate,toDate
https://twitter.com/i/web/status/1095003267837382656,1095003267837382656,"@Sam291084 Dear Lola,we do sincerely apologize for the inconvenience you encountered as this is an exception to the… https://t.co/92fDisqceb",Ethiopian Airlines,flyethiopian,2019-02-08T00:00:00-07:00,2019-03-10T00:00:00-07:00
https://twitter.com/i/web/status/1094888921023111169,1094888921023111169,"@guantai_ Dear Liz, you may contact our local office at your final destination.",Ethiopian Airlines,flyethiopian,2019-02-08T00:00:00-07:00,2019-03-10T00:00:00-07:00
https://twitter.com/i/web/status/1094879043890089984,1094879043890089984,"@Ladacochi Dear Ezzie, please DM us details of the case and let us know to which email address you sent the email to.",Ethiopian Airlines,flyethiopian,2019-02-08T00:00:00-07:00,2019-03-10T00:00:00-07:00
https://twitter.com/i/web/status/1094843955936665601,1094843955936665601,"Mr Tewolde Gebremariam, GCEO of Ethiopian Airlines was awarded The most influential people of African descent (MIPA… https://t.co/BJqsNUec0t",Ethiopian Airlines,flyethiopian,2019-02-08T00:00:00-07:00,2019-03-10T00:00:00-07:00
https://twitter.com/i/web/status/1094840313863176192,1094840313863176192,"@cle_tin Dear @cle_tin, kindly DM us the description of your lap top and your email address.",Ethiopian Airlines,flyethiopian,2019-02-08T00:00:00-07:00,2019-03-10T00:00:00-07:00
https://twitter.com/i/web/status/1094838362127638528,1094838362127638528,"@habesha_meron Dear @habesha_meron, please DM us details of the case so that we can check.",Ethiopian Airlines,flyethiopian,2019-02-08T00:00:00-07:00,2019-03-10T00:00:00-07:00
https://twitter.com/i/web/status/1094834324938084358,1094834324938084358,Ethiopian Aviation Academy is a place with the best reputation in Africa and a training centre where you get the wa… https://t.co/qvlwnRgiQV,Ethiopian Airlines,flyethiopian,2019-02-08T00:00:00-07:00,2019-03-10T00:00:00-07:00
https://twitter.com/i/web/status/1094489021584150528,1094489021584150528,"@JurgensVivier Dear Jurgens, If you have spare time, (6-8 hrs until your connecting flight to your final destinatio… https://t.co/1HENnJesIA",Ethiopian Airlines,flyethiopian,2019-02-08T00:00:00-07:00,2019-03-10T00:00:00-07:00
https://twitter.com/i/web/status/1094488037910814720,1094488037910814720,"@josphat201590 Dear Josphat, please DM us your ticket number so that we can assist you.",Ethiopian Airlines,flyethiopian,2019-02-08T00:00:00-07:00,2019-03-10T00:00:00-07:00
