url,tweet_id,tweet,name,username,fromDate,toDate
https://twitter.com/i/web/status/1104426015189860354,1104426015189860354,"@nyamup Dear peter, We are very sorry to hear about the problem you had with your luggage. please DM us your ticket… https://t.co/LzyCphiaFQ",Ethiopian Airlines,flyethiopian,2019-02-08T00:00:00-07:00,2019-03-10T00:00:00-07:00
https://twitter.com/i/web/status/1103979792674754560,1103979792674754560,"A panel discussion and a welcome ceremony has been held at Oslo, Radisson Blue Hotel for the Ethiopian All women Fl… https://t.co/rr60JDmajg",Ethiopian Airlines,flyethiopian,2019-02-08T00:00:00-07:00,2019-03-10T00:00:00-07:00
https://twitter.com/i/web/status/1103932375229116417,1103932375229116417,Ethiopian Airlines #Allwomenoperated flight to Oslo has just arrived and Received a warm welcome by Diplomats and E… https://t.co/ZOuZPkigQi,Ethiopian Airlines,flyethiopian,2019-02-08T00:00:00-07:00,2019-03-10T00:00:00-07:00
https://twitter.com/i/web/status/1103888831646916621,1103888831646916621,"@hiwot25682717 Dear Hiwot, We are very sorry for the inconvenience. Kindly DM us details of your case so that we will look into it.",Ethiopian Airlines,flyethiopian,2019-02-08T00:00:00-07:00,2019-03-10T00:00:00-07:00
https://twitter.com/i/web/status/1103711927518355456,1103711927518355456,"@lassoleash Dear Cal, we have replied to your DM kindly check.",Ethiopian Airlines,flyethiopian,2019-02-08T00:00:00-07:00,2019-03-10T00:00:00-07:00
https://twitter.com/i/web/status/1103697191502262275,1103697191502262275,"@lassoleash Hello Cal, we apologize for the inconvenience caused. Kindly DM us your father's ticket number and his… https://t.co/wst4CNi1h6",Ethiopian Airlines,flyethiopian,2019-02-08T00:00:00-07:00,2019-03-10T00:00:00-07:00
https://twitter.com/i/web/status/1103693811430113280,1103693811430113280,"@SampoornaKranti Dear Trayambak, we have the flight. Kindly check for a different date.",Ethiopian Airlines,flyethiopian,2019-02-08T00:00:00-07:00,2019-03-10T00:00:00-07:00
https://twitter.com/i/web/status/1103681638284832770,1103681638284832770,"@ZahraZoeb Dear Zahra, we have replied to your DM kindly check.",Ethiopian Airlines,flyethiopian,2019-02-08T00:00:00-07:00,2019-03-10T00:00:00-07:00
https://twitter.com/i/web/status/1103651144675614721,1103651144675614721,The clock is ticking!Are you ready to join us #Oslo  #Ethiopian #Allwomenflight #Balanceforbetter #girlpower… https://t.co/NQplXGjBWX,Ethiopian Airlines,flyethiopian,2019-02-08T00:00:00-07:00,2019-03-10T00:00:00-07:00
https://twitter.com/i/web/status/1103337777113034752,1103337777113034752,"@pixell8r Hello @pixell8r, please let us know your ticket number in the DM so that we can advise you the status of your flight.",Ethiopian Airlines,flyethiopian,2019-02-08T00:00:00-07:00,2019-03-10T00:00:00-07:00
https://twitter.com/i/web/status/1103218349981470720,1103218349981470720,"@rodgenius Dear https://t.co/zngyZpakSZ, Rodgers.
Thank you for contacting Ethiopian!
The flight is canceled for no… https://t.co/m3aMiEPTS0",Ethiopian Airlines,flyethiopian,2019-02-08T00:00:00-07:00,2019-03-10T00:00:00-07:00
https://twitter.com/i/web/status/1103217683544375296,1103217683544375296,"@lucaswafula Dear Lucas
Thank for contacting Ethiopian.
If the flight do not operate or if there is a schedule chan… https://t.co/oLnQvRMNFA",Ethiopian Airlines,flyethiopian,2019-02-08T00:00:00-07:00,2019-03-10T00:00:00-07:00
https://twitter.com/i/web/status/1103217191598596096,1103217191598596096,"@Idahvincent @6 Dear Vincent
Thank you for contacting Ethiopian!
Kindly DM us your ticket number so that we can check the detail.",Ethiopian Airlines,flyethiopian,2019-02-08T00:00:00-07:00,2019-03-10T00:00:00-07:00
https://twitter.com/i/web/status/1103171495637991427,1103171495637991427,"RT @NorwayinAddis: @NorwayinAddis visited the impressive Ethiopian Airlines Facilities in Bole, Addis. 5th #allwomenflight on #WomensDay go…",Ethiopian Airlines,flyethiopian,2019-02-08T00:00:00-07:00,2019-03-10T00:00:00-07:00
https://twitter.com/i/web/status/1103048208354291712,1103048208354291712,@fishhailu83 @GetachewSS You're most welcome dear Fishailu. We are honored to have a caring and supporting customer such as yourself.,Ethiopian Airlines,flyethiopian,2019-02-08T00:00:00-07:00,2019-03-10T00:00:00-07:00
https://twitter.com/i/web/status/1103041565495386112,1103041565495386112,"@fishhailu83 @GetachewSS Dear Fishailu, please be informed that we are working on Mr. Samuel's case and we have bee… https://t.co/dJAnUEl0lI",Ethiopian Airlines,flyethiopian,2019-02-08T00:00:00-07:00,2019-03-10T00:00:00-07:00
https://twitter.com/i/web/status/1102981584121225216,1102981584121225216,"@EwotonPius Hello Pius, we do have a flight to Jinka. Kindly check our website/mobile app to make a booking.",Ethiopian Airlines,flyethiopian,2019-02-08T00:00:00-07:00,2019-03-10T00:00:00-07:00
https://twitter.com/i/web/status/1102975634572263430,1102975634572263430,"@RafaaelGonzalez Dear @RafaaelGonzalez, this could be due to internet connection problem, kindly try it again later… https://t.co/BNqiB7sHsO",Ethiopian Airlines,flyethiopian,2019-02-08T00:00:00-07:00,2019-03-10T00:00:00-07:00
https://twitter.com/i/web/status/1102871710792146944,1102871710792146944,"@kyaligonzakahwa Dear  @kyaligonzakahwa, We are very sorry for the inconvenience. Kindly DM us details of your case… https://t.co/VjDEsvn9pv",Ethiopian Airlines,flyethiopian,2019-02-08T00:00:00-07:00,2019-03-10T00:00:00-07:00
https://twitter.com/i/web/status/1102851818411958273,1102851818411958273,"Statement of apology to our valued customers who traveled on board ET 502 on March 4, 2019. #ET502… https://t.co/fPAx18KUnI",Ethiopian Airlines,flyethiopian,2019-02-08T00:00:00-07:00,2019-03-10T00:00:00-07:00
https://twitter.com/i/web/status/1102842544550043648,1102842544550043648,The B-737-800 Freighter will give a new capability to serve short haul destinations in African and the Middle East… https://t.co/C0JD16NyIY,Ethiopian Airlines,flyethiopian,2019-02-08T00:00:00-07:00,2019-03-10T00:00:00-07:00
https://twitter.com/i/web/status/1102624266229567490,1102624266229567490,"@Shan_anee Dear Shanon, please DM us your ticket number and the correct name so that we can check and advise you.",Ethiopian Airlines,flyethiopian,2019-02-08T00:00:00-07:00,2019-03-10T00:00:00-07:00
https://twitter.com/i/web/status/1102532741277601800,1102532741277601800,"@GetachewSS Dear @GetachewSS, Kindly DM us the case so that we will look into it.",Ethiopian Airlines,flyethiopian,2019-02-08T00:00:00-07:00,2019-03-10T00:00:00-07:00
https://twitter.com/i/web/status/1102456918839382016,1102456918839382016,"@aasnake1 Dear @aasnake1, Thank you for the remark. kindly DM us detail so that we will look into the case.",Ethiopian Airlines,flyethiopian,2019-02-08T00:00:00-07:00,2019-03-10T00:00:00-07:00
https://twitter.com/i/web/status/1102169632918642688,1102169632918642688,RT @TayeAtske: Ethiopian Airlines to celebrate International Women’s Day with flight entirely staffed by women – Women in the World https:/…,Ethiopian Airlines,flyethiopian,2019-02-08T00:00:00-07:00,2019-03-10T00:00:00-07:00
https://twitter.com/i/web/status/1102110826708828160,1102110826708828160,"Ready to take your business to the next level? Visit  https://t.co/sOyE7T2BBy. Hurry, only limited spaces remain… https://t.co/QEXV8b1U0t",Ethiopian Airlines,flyethiopian,2019-02-08T00:00:00-07:00,2019-03-10T00:00:00-07:00
https://twitter.com/i/web/status/1101727073033433088,1101727073033433088,Happy Anniversary of the victory of Adwa! #BattleofAdwa #BlackHistory https://t.co/GBGFmKO3Ug,Ethiopian Airlines,flyethiopian,2019-02-08T00:00:00-07:00,2019-03-10T00:00:00-07:00
https://twitter.com/i/web/status/1101468225764765697,1101468225764765697,"Ethiopian Airlines has taken delivery of its first B737-800 freighter, the first of its kind in the Ethiopian Cargo… https://t.co/MglNAGkPKJ",Ethiopian Airlines,flyethiopian,2019-02-08T00:00:00-07:00,2019-03-10T00:00:00-07:00
https://twitter.com/i/web/status/1101450503475683333,1101450503475683333,Ethiopian Airlines Aviation Academy graduated 20 Cabin Crew trainees from Mozambique as  part of Ethiopian Airlines… https://t.co/6b5ZwPOIa6,Ethiopian Airlines,flyethiopian,2019-02-08T00:00:00-07:00,2019-03-10T00:00:00-07:00
https://twitter.com/i/web/status/1101388600422354945,1101388600422354945,"Ethiopian Airlines colorfully celebrated the Chinese new year at Sky Light Hotel on Feb 26, 2019. The event was hel… https://t.co/2HhK8RKJmJ",Ethiopian Airlines,flyethiopian,2019-02-08T00:00:00-07:00,2019-03-10T00:00:00-07:00
https://twitter.com/i/web/status/1101353534061268992,1101353534061268992,"@RavS82 Dear @RavS82, Thank you for contacting us.  We are very sorry for the inconvenience. kindly try it with ano… https://t.co/QjodQDUUFX",Ethiopian Airlines,flyethiopian,2019-02-08T00:00:00-07:00,2019-03-10T00:00:00-07:00
https://twitter.com/i/web/status/1101038571132239874,1101038571132239874,"Ethiopian Cargo and Logistics Services, Africa’s largest and multi-award winning cargo operator, will receive its f… https://t.co/1VkR2PsEpK",Ethiopian Airlines,flyethiopian,2019-02-08T00:00:00-07:00,2019-03-10T00:00:00-07:00
https://twitter.com/i/web/status/1100661527437369345,1100661527437369345,Dawning bright &amp; warm for African skies!#Ethiopian #Windowviewwednesday #EtMoments https://t.co/2Gx6DOW4Xg,Ethiopian Airlines,flyethiopian,2019-02-08T00:00:00-07:00,2019-03-10T00:00:00-07:00
https://twitter.com/i/web/status/1100323072895270912,1100323072895270912,"The Lucys are about to control the skies for the 5th time, flying to Oslo on the coming March 8.
#Ethiopian… https://t.co/wFI98ot1MJ",Ethiopian Airlines,flyethiopian,2019-02-08T00:00:00-07:00,2019-03-10T00:00:00-07:00
https://twitter.com/i/web/status/1100266697339092992,1100266697339092992,"Mr Tewolde GebreMariam, Group CEO of Ethiopian Airlines, has been inducted into The African CEO's Hall Of Fame duri… https://t.co/WgDoiumcEb",Ethiopian Airlines,flyethiopian,2019-02-08T00:00:00-07:00,2019-03-10T00:00:00-07:00
https://twitter.com/i/web/status/1099990352897953792,1099990352897953792,"Ethiopian Cargo &amp; Logistics Services, Africa’s largest cargo operator, has been crowned with ‘African Cargo Airline… https://t.co/ahVyafn9aU",Ethiopian Airlines,flyethiopian,2019-02-08T00:00:00-07:00,2019-03-10T00:00:00-07:00
https://twitter.com/i/web/status/1099916532870717441,1099916532870717441,Ethiopian Airlines Aviation Academy has planned to give a training on the latest updates of IATA and ICAO. Enrol at… https://t.co/nG7DDYAgmX,Ethiopian Airlines,flyethiopian,2019-02-08T00:00:00-07:00,2019-03-10T00:00:00-07:00
https://twitter.com/i/web/status/1099404561918427141,1099404561918427141,"@mulbrotha Dear MulbrothA, you are absolutely right. and thank you for the feedback",Ethiopian Airlines,flyethiopian,2019-02-08T00:00:00-07:00,2019-03-10T00:00:00-07:00
https://twitter.com/i/web/status/1099396766443716608,1099396766443716608,"@mulbrotha Dear MulbrothA, Thank you for contacting us, kindly note that it is a fraud message and whenever we have… https://t.co/JuIsLm2WTr",Ethiopian Airlines,flyethiopian,2019-02-08T00:00:00-07:00,2019-03-10T00:00:00-07:00
https://twitter.com/i/web/status/1099342946011361280,1099342946011361280,@FlawlessinET Dear Yoadan.  We are very sorry to hear about the problem you had at the office . may we have the tic… https://t.co/YvWLbDCxCF,Ethiopian Airlines,flyethiopian,2019-02-08T00:00:00-07:00,2019-03-10T00:00:00-07:00
https://twitter.com/i/web/status/1099340103024033792,1099340103024033792,"@Carolaleee1 Hello Carolaleee, may we have the ticket number please. regards",Ethiopian Airlines,flyethiopian,2019-02-08T00:00:00-07:00,2019-03-10T00:00:00-07:00
https://twitter.com/i/web/status/1099009423169724416,1099009423169724416,"@andrew_bryant Hello Andrew,may we have your ticket number please 
Mulualem m.",Ethiopian Airlines,flyethiopian,2019-02-08T00:00:00-07:00,2019-03-10T00:00:00-07:00
https://twitter.com/i/web/status/1098922551110238208,1098922551110238208,"Turn Everyday Purchase in to Rewards!
Use your co-brand card and earn extra miles. Enjoy 5000 bonus miles offered u… https://t.co/Dzv5vZgRpa",Ethiopian Airlines,flyethiopian,2019-02-08T00:00:00-07:00,2019-03-10T00:00:00-07:00
https://twitter.com/i/web/status/1098541065081180160,1098541065081180160,"@getahuntes Dear Getahun,We are deeply sorry for the inconveniences. Kindly DM us your experience so that we can fo… https://t.co/mjvardU8hg",Ethiopian Airlines,flyethiopian,2019-02-08T00:00:00-07:00,2019-03-10T00:00:00-07:00
https://twitter.com/i/web/status/1098539952994955264,1098539952994955264,"@VazahaTandroy Dear Nicholas, we do apologize for the inconveniences. Kindly DM us the Error so that we can investigate and fix the problem.",Ethiopian Airlines,flyethiopian,2019-02-08T00:00:00-07:00,2019-03-10T00:00:00-07:00
https://twitter.com/i/web/status/1098112427600867328,1098112427600867328,This beautiful shot was taken by Daniel Mektachew. #windowviewwednesday #ETMoments https://t.co/Nrgr5POLc5,Ethiopian Airlines,flyethiopian,2019-02-08T00:00:00-07:00,2019-03-10T00:00:00-07:00
https://twitter.com/i/web/status/1098096796952334336,1098096796952334336,"@Sam291084 Dear Lola, We sincerely apologize for the inconveniences.",Ethiopian Airlines,flyethiopian,2019-02-08T00:00:00-07:00,2019-03-10T00:00:00-07:00
https://twitter.com/i/web/status/1097857809335705600,1097857809335705600,"AIR CARGO AFRICA - 2019 FROM FEBRUARY 19 TO 21, 2019 AT JOHANNESBURG, SOUTH AFRICA. VISIT US @ BOOTH #40… https://t.co/SHcIuKsRUg",Ethiopian Airlines,flyethiopian,2019-02-08T00:00:00-07:00,2019-03-10T00:00:00-07:00
https://twitter.com/i/web/status/1097733347386814464,1097733347386814464,@liberty409 Dear liberty now.we do sincerely apologize for the inconvenience you encountered.Kindly DM us your book… https://t.co/PW85dQMZK8,Ethiopian Airlines,flyethiopian,2019-02-08T00:00:00-07:00,2019-03-10T00:00:00-07:00
https://twitter.com/i/web/status/1097732230892408832,1097732230892408832,"@iamravi15 Dear Ravi Shingala, we do sincerely apologize for the inconvenience you encountered.Kindly DM us more details.",Ethiopian Airlines,flyethiopian,2019-02-08T00:00:00-07:00,2019-03-10T00:00:00-07:00
https://twitter.com/i/web/status/1097731047817650177,1097731047817650177,"@Siddhan67936900 Dear Siddhant, Kindly check your inbox message.",Ethiopian Airlines,flyethiopian,2019-02-08T00:00:00-07:00,2019-03-10T00:00:00-07:00
https://twitter.com/i/web/status/1097490579074760704,1097490579074760704,RT @chinafrica1: Ethiopian Airlines caters to Chinese tourists visiting Addis Ababa https://t.co/2jWNeNqHQS via @cgtnofficial #SinoAfrica,Ethiopian Airlines,flyethiopian,2019-02-08T00:00:00-07:00,2019-03-10T00:00:00-07:00
https://twitter.com/i/web/status/1097476179345461248,1097476179345461248,"@pixell8r Dear @pixell8r, We are very sorry for the inconvenience. Kindly DM us details of your case so that we will look into it.",Ethiopian Airlines,flyethiopian,2019-02-08T00:00:00-07:00,2019-03-10T00:00:00-07:00
https://twitter.com/i/web/status/1097393818255720448,1097393818255720448,Practicing in the best possible way. Learn to develop your aviation career at Ethiopian Aviation academy.… https://t.co/ewoJCrRHAQ,Ethiopian Airlines,flyethiopian,2019-02-08T00:00:00-07:00,2019-03-10T00:00:00-07:00
https://twitter.com/i/web/status/1097384768113688576,1097384768113688576,"@MaxDaddy78 Dear @MaxDaddy78,  Kindly DM us details so that we will look into it.",Ethiopian Airlines,flyethiopian,2019-02-08T00:00:00-07:00,2019-03-10T00:00:00-07:00
https://twitter.com/i/web/status/1097362164665540608,1097362164665540608,"@tori_crandall Dear @tori_crandall, We are very sorry for the inconvenience. Kindly DM us details of your case incl… https://t.co/aysr5gYQa3",Ethiopian Airlines,flyethiopian,2019-02-08T00:00:00-07:00,2019-03-10T00:00:00-07:00
https://twitter.com/i/web/status/1097087452844642305,1097087452844642305,"@Civoknu Dear @Civoknu, We are very sorry for the inconvenience. Kindly DM us more details of your case for further investigation.",Ethiopian Airlines,flyethiopian,2019-02-08T00:00:00-07:00,2019-03-10T00:00:00-07:00
https://twitter.com/i/web/status/1097025200212848640,1097025200212848640,"@4lahkemmie Dear @4lahkemmie, We are very sorry for the inconvenience. Kindly DM us details of your case so that we will look into it.",Ethiopian Airlines,flyethiopian,2019-02-08T00:00:00-07:00,2019-03-10T00:00:00-07:00
https://twitter.com/i/web/status/1097001966901882881,1097001966901882881,"@4lahkemmie Dear @4lahkemmie, We are very sorry for the inconvenience. Kindly DM us details of your case so that we will look into it.",Ethiopian Airlines,flyethiopian,2019-02-08T00:00:00-07:00,2019-03-10T00:00:00-07:00
https://twitter.com/i/web/status/1096952370968383489,1096952370968383489,witness Eye-catching nature of #Ethiopia. #beautifulethiopia #Landoforigins. secure your visa at… https://t.co/4BEFUHHTg6,Ethiopian Airlines,flyethiopian,2019-02-08T00:00:00-07:00,2019-03-10T00:00:00-07:00
https://twitter.com/i/web/status/1096650096031207425,1096650096031207425,"@liltraveljuice Dear @liltraveljuice, kindly let us know details of your experience with us in the DM.",Ethiopian Airlines,flyethiopian,2019-02-08T00:00:00-07:00,2019-03-10T00:00:00-07:00
https://twitter.com/i/web/status/1096649442692907008,1096649442692907008,"@Georgiadismoe1 Dear Barbieana, please DM us details of the case so that we can take a look.",Ethiopian Airlines,flyethiopian,2019-02-08T00:00:00-07:00,2019-03-10T00:00:00-07:00
https://twitter.com/i/web/status/1096328528252096513,1096328528252096513,"@cle_tin @traveleatslay Dear @cle_tin @traveleatslay, We are very sorry for the inconvenience once again. The detai… https://t.co/d5ZLBjj6hp",Ethiopian Airlines,flyethiopian,2019-02-08T00:00:00-07:00,2019-03-10T00:00:00-07:00
https://twitter.com/i/web/status/1096325886188679168,1096325886188679168,"@danicooleth Dear  @danicooleth, Thank you for contacting us. Kindly DM us your intended travel date,your departure… https://t.co/vk49ebrx7V",Ethiopian Airlines,flyethiopian,2019-02-08T00:00:00-07:00,2019-03-10T00:00:00-07:00
https://twitter.com/i/web/status/1096324461710766081,1096324461710766081,"@oh_my_kesh Dear  @oh_my_kesh, We are very sorry for the inconvenience. Kindly DM us details of your case so that we will look into it.",Ethiopian Airlines,flyethiopian,2019-02-08T00:00:00-07:00,2019-03-10T00:00:00-07:00
https://twitter.com/i/web/status/1096323995488669696,1096323995488669696,"@cle_tin Dear  @cle_tin, We are very sorry for the inconvenience. Kindly DM us details of your case so that we will look into it.",Ethiopian Airlines,flyethiopian,2019-02-08T00:00:00-07:00,2019-03-10T00:00:00-07:00
https://twitter.com/i/web/status/1096323688826327040,1096323688826327040,"@traveleatslay Dear @traveleatslay, We are very sorry for the inconvenience. Kindly DM us details of the case so that we will look into it.",Ethiopian Airlines,flyethiopian,2019-02-08T00:00:00-07:00,2019-03-10T00:00:00-07:00
https://twitter.com/i/web/status/1096286918688587776,1096286918688587776,Ethiopian Airlines has rapidly developed into the largest airline in Africa. But realizing the vision of growing bo… https://t.co/PtOMNyEYux,Ethiopian Airlines,flyethiopian,2019-02-08T00:00:00-07:00,2019-03-10T00:00:00-07:00
https://twitter.com/i/web/status/1096280359833124864,1096280359833124864,"@mouha737 Dear  @mouha737, We are very sorry for the inconvenience. Kindly DM us details of the case so that we will look into it.",Ethiopian Airlines,flyethiopian,2019-02-08T00:00:00-07:00,2019-03-10T00:00:00-07:00
https://twitter.com/i/web/status/1096009749466894336,1096009749466894336,"Congratulations to Mr Musa/Nebil , who has booked on Ethiopian Airlines Mobile app and became the raffle winner to… https://t.co/2aFMv8AgMI",Ethiopian Airlines,flyethiopian,2019-02-08T00:00:00-07:00,2019-03-10T00:00:00-07:00
https://twitter.com/i/web/status/1095953968704950273,1095953968704950273,"@SarahreMarks Dear @SarahreMarks, Thank you for contacting us. Kindly DM us more details so that we will look into it.",Ethiopian Airlines,flyethiopian,2019-02-08T00:00:00-07:00,2019-03-10T00:00:00-07:00
https://twitter.com/i/web/status/1095923972464668672,1095923972464668672,"@Psalmuel35 Dear @Psalmuel35, Thank you for contacting us.  Kindly DM us the case so that we will look into it.",Ethiopian Airlines,flyethiopian,2019-02-08T00:00:00-07:00,2019-03-10T00:00:00-07:00
https://twitter.com/i/web/status/1095915432194781184,1095915432194781184,"@Eritrea2Hailat Dear @Eritrea2Hailat, Kindly DM us details of the case so that we will look into it.",Ethiopian Airlines,flyethiopian,2019-02-08T00:00:00-07:00,2019-03-10T00:00:00-07:00
https://twitter.com/i/web/status/1095771606515937280,1095771606515937280,"@freedom_4_girls @HeyGirlsUK @AmikaGeorge @RedBoxProject Dear Freedom4girls, how can we assist you, is it  regardin… https://t.co/GlFEanlqJW",Ethiopian Airlines,flyethiopian,2019-02-08T00:00:00-07:00,2019-03-10T00:00:00-07:00
https://twitter.com/i/web/status/1095769856153214976,1095769856153214976,"@riley_globetrtr Dear Riley,yes we can assist you with that may we have the ticket number please regards
Mulualem m.",Ethiopian Airlines,flyethiopian,2019-02-08T00:00:00-07:00,2019-03-10T00:00:00-07:00
https://twitter.com/i/web/status/1095680661585887232,1095680661585887232,"@duhaAlzubair Dear @duhaAlzubair, Thank you for contacting us . Kindly DM us details of your case so that we will look into it.",Ethiopian Airlines,flyethiopian,2019-02-08T00:00:00-07:00,2019-03-10T00:00:00-07:00
https://twitter.com/i/web/status/1095680039075672064,1095680039075672064,"@NaomiSenbet @Wharton @TewoldeET Dear Naomi Senbet, We have sent you through your DM. Kindly check your DM.",Ethiopian Airlines,flyethiopian,2019-02-08T00:00:00-07:00,2019-03-10T00:00:00-07:00
https://twitter.com/i/web/status/1095676813441990658,1095676813441990658,"@NaomiSenbet @Wharton @TewoldeET Dear Naomi Senbet, We have sent you through your DM. Kindly check your DM.",Ethiopian Airlines,flyethiopian,2019-02-08T00:00:00-07:00,2019-03-10T00:00:00-07:00
https://twitter.com/i/web/status/1095574472810266624,1095574472810266624,"@NaomiSenbet @Wharton @TewoldeET Dear @NaomiSenbet, Thank you for contacting us. Kindly send your request to our lo… https://t.co/mxsBU0Lgbb",Ethiopian Airlines,flyethiopian,2019-02-08T00:00:00-07:00,2019-03-10T00:00:00-07:00
https://twitter.com/i/web/status/1095571950527803392,1095571950527803392,RT @Av8Spotting: Lucky enough to get the chance to go up the @manairport tower last month. My first shot at MAN with a @flyethiopian oh and…,Ethiopian Airlines,flyethiopian,2019-02-08T00:00:00-07:00,2019-03-10T00:00:00-07:00
https://twitter.com/i/web/status/1095549795748462593,1095549795748462593,"@tweet_kerr Dear Common man, Kindly DM us detail so that we will look into it.",Ethiopian Airlines,flyethiopian,2019-02-08T00:00:00-07:00,2019-03-10T00:00:00-07:00
https://twitter.com/i/web/status/1095307017831493632,1095307017831493632,"@NotYour_Queen Dear @NotYour_Queen, We are very sorry for sorry for the inconvenience. Kindly DM us details of your… https://t.co/P1af7F1ZqO",Ethiopian Airlines,flyethiopian,2019-02-08T00:00:00-07:00,2019-03-10T00:00:00-07:00
https://twitter.com/i/web/status/1095282886280912897,1095282886280912897,"@tarun2gupta Dear Tarun, our ET holidays department is a better contact for tour packages information. Kindly get i… https://t.co/Kak2PRIFr1",Ethiopian Airlines,flyethiopian,2019-02-08T00:00:00-07:00,2019-03-10T00:00:00-07:00
https://twitter.com/i/web/status/1095228516424187904,1095228516424187904,"@mama_sarakasi Dear Marion, we have replied to your DM kindly check.",Ethiopian Airlines,flyethiopian,2019-02-08T00:00:00-07:00,2019-03-10T00:00:00-07:00
https://twitter.com/i/web/status/1095204582177886208,1095204582177886208,"@Sahelu_bs Dear Sahelu, please DM us the details including the passenger's ticket number and email address.",Ethiopian Airlines,flyethiopian,2019-02-08T00:00:00-07:00,2019-03-10T00:00:00-07:00
https://twitter.com/i/web/status/1095203509799141376,1095203509799141376,"@mama_sarakasi Dear Marion, please DM us details of the case along with the passenger's ticket number and email address.",Ethiopian Airlines,flyethiopian,2019-02-08T00:00:00-07:00,2019-03-10T00:00:00-07:00
https://twitter.com/i/web/status/1095200482291785728,1095200482291785728,"@halatotmac Dear @halatotmac, Thank you for contacting us.  Kindly DM us more so that we will look into it.",Ethiopian Airlines,flyethiopian,2019-02-08T00:00:00-07:00,2019-03-10T00:00:00-07:00
https://twitter.com/i/web/status/1095199692407877632,1095199692407877632,"@WebbJohanne Dear @WebbJohanne, We are very sorry for the inconvenience. Kindly DM us more details of your case inc… https://t.co/8bdwTr1U0x",Ethiopian Airlines,flyethiopian,2019-02-08T00:00:00-07:00,2019-03-10T00:00:00-07:00
https://twitter.com/i/web/status/1095191804725641216,1095191804725641216,@ante_ab Sure you can dear Ante.,Ethiopian Airlines,flyethiopian,2019-02-08T00:00:00-07:00,2019-03-10T00:00:00-07:00
https://twitter.com/i/web/status/1095105105316204545,1095105105316204545,"@Sam291084 Dear Lola, we do sincerely apologize for the inconvenience you encountered as this is an exception to th… https://t.co/MFm12CWfzF",Ethiopian Airlines,flyethiopian,2019-02-08T00:00:00-07:00,2019-03-10T00:00:00-07:00
https://twitter.com/i/web/status/1095080034082025472,1095080034082025472,"Save your time, minimize your cost and gain more control over your trips! We deliver an end- to-end customer experi… https://t.co/3m3qm31Qrg",Ethiopian Airlines,flyethiopian,2019-02-08T00:00:00-07:00,2019-03-10T00:00:00-07:00
