url,tweet_id,tweet,name,username,fromDate,toDate
https://twitter.com/i/web/status/436015005914251264,436015005914251264,"@elaine0506 Hi, you may contact our call centre at 1 300 88 3000 (within Msia) or visit the nearest MAS ticketing office for assistance. TQ",Malaysia Airlines,MAS,2014-02-06T00:00:00-07:00,2014-03-08T00:00:00-07:00
https://twitter.com/i/web/status/436008697672630272,436008697672630272,"@elaine0506 Hi Elaine, you can only check in 48 hours before your flight so you will not be able to check-in together. Thank you.",Malaysia Airlines,MAS,2014-02-06T00:00:00-07:00,2014-03-08T00:00:00-07:00
https://twitter.com/i/web/status/435989846067134464,435989846067134464,@Raudhah_Nazran Hi Raudah - the pilot bear is available for purchase from Temptations In-Flight Shopping. Do check it out!,Malaysia Airlines,MAS,2014-02-06T00:00:00-07:00,2014-03-08T00:00:00-07:00
https://twitter.com/i/web/status/435972052151836674,435972052151836674,Hello from our Mr. Pilot bear! Let's explore Cambodia this week :) #MHmoments #MHjourneys http://t.co/KtrF56PRU0,Malaysia Airlines,MAS,2014-02-06T00:00:00-07:00,2014-03-08T00:00:00-07:00
https://twitter.com/i/web/status/435967090931949568,435967090931949568,"@OrdSaja Hi Ridzuan, kindly email your feedback to enrich@malaysiaairlines.com, we'll check it for you. Thank you.",Malaysia Airlines,MAS,2014-02-06T00:00:00-07:00,2014-03-08T00:00:00-07:00
